{
  "$schema": "https://phuhh98.github.io/sloth/schemas/component-contract/0.0.1/schema.json",
  "name": "cta-banner",
  "label": "CTA Banner",
  "kind": "section",
  "version": "0.0.1",
  "schemaVersion": "0.0.1",
  "dataset": [
    {
      "key": "heading",
      "label": "Heading",
      "type": "string",
      "required": true
    },
    {
      "key": "actionLabel",
      "label": "Action Label",
      "type": "string",
      "required": true
    },
    {
      "key": "actionHref",
      "label": "Action Href",
      "type": "string",
      "required": true
    },
    {
      "key": "emphasis",
      "label": "Emphasis",
      "type": "option",
      "options": [
        { "label": "Strong", "value": "strong" },
        { "label": "Subtle", "value": "subtle" }
      ]
    }
  ],
  "renderMeta": {
    "rendererKey": "cta-banner"
  }
}
