{
  "$schema": "https://phuhh98.github.io/sloth/schemas/component-contract/0.0.1/schema.json",
  "name": "faq-list",
  "label": "FAQ List",
  "kind": "section",
  "version": "0.0.1",
  "schemaVersion": "0.0.1",
  "dataset": [
    {
      "key": "heading",
      "label": "Heading",
      "type": "string",
      "required": true
    },
    {
      "key": "questionLimit",
      "label": "Question Limit",
      "type": "number"
    },
    {
      "key": "defaultOpen",
      "label": "Default Open",
      "type": "option",
      "options": [
        { "label": "No", "value": false },
        { "label": "Yes", "value": true }
      ]
    }
  ],
  "renderMeta": {
    "rendererKey": "faq-list"
  }
}
