{
  "$schema": "https://phuhh98.github.io/sloth/schemas/component-contract/0.0.1/schema.json",
  "name": "feature-grid",
  "label": "Feature Grid",
  "kind": "section",
  "version": "0.0.1",
  "schemaVersion": "0.0.1",
  "dataset": [
    {
      "key": "heading",
      "label": "Heading",
      "type": "string",
      "required": true
    },
    {
      "key": "featureCount",
      "label": "Feature Count",
      "type": "number"
    },
    {
      "key": "columns",
      "label": "Columns",
      "type": "number"
    }
  ],
  "renderMeta": {
    "rendererKey": "feature-grid"
  }
}
